{
  "schema_version": "1.0",
  "status": "published",
  "report_date": "2026-08-07",
  "edition": "evening",
  "generated_at_bjt": "2026-08-07T23:30:00+08:00",
  "weekend_mode": false,
  "title": "全球跨资产雷达归档管道测试",
  "one_sentence_conclusion": "非市场报告；仅验证GitHub归档写入、配对和Schema结构。",
  "regime": "test_only",
  "worth_taking_risk": false,
  "data_cutoff": {
    "beijing_time": "2026-08-07T23:30:00+08:00",
    "us_cash_market": "not-applicable",
    "china_cash_market": "not-applicable",
    "notes": [
      "test_only"
    ]
  },
  "input_snapshots": {
    "china_options_repository": "farfromexact/China-Options-Engine",
    "china_options_path": null,
    "china_options_date": null,
    "china_options_generated_at": null,
    "china_options_fresh": null,
    "china_options_official_coverage": null
  },
  "source_status": {
    "test_only": true
  },
  "dashboard": [],
  "meaningful_changes": [],
  "top_opportunities": [],
  "top_trade_cards": [],
  "gold_tracking": {},
  "ai_tracking": {},
  "china_tracking": {
    "qualified_trade": false,
    "score": null,
    "preferred_future": null,
    "futures_option_linkage": {}
  },
  "event_calendar": [],
  "action_list": {
    "A": "无；本文件不是市场报告。",
    "B": "无；本文件不是市场报告。",
    "C": "等待Scheduled Task归档prompt完成配置后进行端到端测试。",
    "D": "不得把本测试文件当作交易建议。"
  },
  "risk_budget": {
    "test_only": true
  },
  "sources": [],
  "archive": {
    "markdown_path": "tests/2026-08-07T23-30-00_evening.md",
    "json_path": "tests/2026-08-07T23-30-00_evening.json",
    "latest_markdown_path": null,
    "latest_json_path": null,
    "archive_status": "success",
    "commit_sha": null,
    "error": null
  }
}
