{
  "schema_version": "1.0",
  "status": "published",
  "report_date": "YYYY-MM-DD",
  "edition": "morning",
  "generated_at_bjt": "YYYY-MM-DDTHH:MM:SS+08:00",
  "weekend_mode": false,
  "title": "全球跨资产高风险机会雷达｜晨间版",
  "one_sentence_conclusion": "",
  "regime": "mixed",
  "worth_taking_risk": false,
  "data_cutoff": {
    "beijing_time": "",
    "us_cash_market": "closed|open|pre-market|not-applicable",
    "china_cash_market": "closed|open|not-applicable",
    "notes": []
  },
  "input_snapshots": {
    "china_options_repository": "farfromexact/China-Options-Engine",
    "china_options_path": "data/radar_latest.json",
    "china_options_date": null,
    "china_options_generated_at": null,
    "china_options_fresh": null,
    "china_options_official_coverage": null
  },
  "source_status": {},
  "dashboard": [],
  "meaningful_changes": [],
  "top_opportunities": [],
  "top_trade_cards": [],
  "gold_tracking": {},
  "ai_tracking": {},
  "china_tracking": {
    "qualified_trade": null,
    "score": null,
    "preferred_future": null,
    "futures_option_linkage": {
      "IH_HO": {},
      "IF_IO": {},
      "IC_proxy": {},
      "IM_MO": {}
    }
  },
  "event_calendar": [],
  "action_list": {
    "A": "",
    "B": "",
    "C": "",
    "D": ""
  },
  "risk_budget": {},
  "sources": [],
  "archive": {
    "markdown_path": null,
    "json_path": null,
    "latest_markdown_path": null,
    "latest_json_path": null,
    "archive_status": "pending",
    "commit_sha": null,
    "error": null
  }
}
